[
  {
    "id": "wood-001",
    "material_identity_id": "dimensional-lumber",
    "name": "Fictional dimensional lumber",
    "quantity": 5500,
    "unit": "kg",
    "source_record_id": "RX-FICT-WOOD-A1A3"
  },
  {
    "id": "concrete-001",
    "material_identity_id": "concrete",
    "name": "Fictional concrete",
    "quantity": 18000,
    "unit": "kg",
    "source_record_id": "RX-FICT-CONCRETE-A1A3"
  },
  {
    "id": "steel-001",
    "material_identity_id": "reinforcing-steel",
    "name": "Fictional reinforcing steel",
    "quantity": 900,
    "unit": "kg",
    "source_record_id": "RX-FICT-STEEL-A1A3"
  }
]
